{
  "$schema": "http://json-schema.org/draft-07/schema#",
  "$id": "internal://clinical/assessmentKnowledge/assessmentObject.schema.json",
  "title": "RF Assessment Knowledge Object (v2 — RF-ASSESS Batch 1)",
  "$comment": "NON-EXECUTABLE structural schema for draft Rectus Femoris assessment metadata. Unknown top-level fields are disallowed (additionalProperties:false). An assessment object describes HOW evidence about a capacity is gathered (observed/asked), contributing qualitatively to capacity evidence. It carries NO score, NO threshold, NO pass/fail decision, NO timeline, NO dosage, NO prescription, and NO diagnosis / autonomous-triage / progression / readiness / RTT / RTS / clearance authority. capacities_measured_or_informed references existing universal CAP-### objects only (never RF-CAP or demand-profile objects). Objects must remain draft/pending, clinically not approved, non-executable, runtime-disconnected, and metadata-only.",
  "type": "object",
  "additionalProperties": false,
  "required": [
    "assessment_id",
    "name",
    "module",
    "assessment_status",
    "approval_status",
    "clinical_approval_status",
    "executable",
    "runtime_integration",
    "permitted_use",
    "assessment_purpose_category",
    "what_it_observes",
    "capacities_measured_or_informed",
    "rf_relevance",
    "user_facing_question_or_prompt",
    "clinician_facing_note",
    "evidence_contribution",
    "limitations",
    "high_caution_flag",
    "governance_notes",
    "allowed_when",
    "blocked_when",
    "notes"
  ],
  "properties": {
    "assessment_id": {
      "type": "string",
      "pattern": "^(RF-ASSESS-[0-9]{3})?$",
      "description": "Stable unique identifier for an RF assessment object. Empty string is permitted only in the blank template."
    },
    "name": { "type": "string" },
    "module": { "type": "string", "enum": ["rectus_femoris"] },
    "assessment_status": { "type": "string", "enum": ["draft"] },
    "approval_status": { "type": "string", "enum": ["pending"] },
    "clinical_approval_status": { "type": "string", "enum": ["not_approved"] },
    "executable": { "type": "boolean", "const": false },
    "runtime_integration": { "type": "string", "enum": ["none"] },
    "permitted_use": { "type": "string", "enum": ["assessment_metadata_only"] },
    "assessment_purpose_category": { "type": "string", "description": "Single category from the shared assessment-purpose taxonomy." },
    "what_it_observes": { "type": "string" },
    "capacities_measured_or_informed": {
      "type": "array",
      "items": { "type": "string", "pattern": "^CAP-[0-9]{3}$" },
      "description": "Universal CAP-### capacities this assessment contributes evidence to. References only; never a clearance decision. May be empty for safety/diagnosis-context screens."
    },
    "rf_relevance": { "type": "string" },
    "user_facing_question_or_prompt": { "type": "string" },
    "clinician_facing_note": { "type": "string" },
    "evidence_contribution": { "type": "string", "description": "Qualitative description of which capacity evidence this can raise. Never a score, threshold, or pass/fail." },
    "limitations": { "type": "string" },
    "high_caution_flag": { "type": "boolean" },
    "governance_notes": { "type": "string" },
    "allowed_when": { "type": "array", "items": { "type": "string" }, "description": "Inert metadata context only. Never a runtime-selection trigger." },
    "blocked_when": { "type": "array", "items": { "type": "string" } },
    "notes": { "type": ["string", "null"] }
  }
}
