{
  "assessment_id": "RF-ASSESS-005",
  "name": "hip_flexion_range_screen",
  "module": "rectus_femoris",
  "assessment_status": "draft",
  "approval_status": "pending",
  "clinical_approval_status": "not_approved",
  "executable": false,
  "runtime_integration": "none",
  "permitted_use": "assessment_metadata_only",
  "assessment_purpose_category": "range_of_motion",
  "what_it_observes": "available hip-flexion range and symptom response",
  "capacities_measured_or_informed": [
    "CAP-008"
  ],
  "rf_relevance": "RF crosses the hip; flexion range supports loading",
  "user_facing_question_or_prompt": "Can you bring your knee toward your chest comfortably?",
  "clinician_facing_note": "Qualitative range observation; no degrees.",
  "evidence_contribution": "Can raise CAP-008 evidence qualitatively.",
  "limitations": "Estimation without goniometry.",
  "high_caution_flag": false,
  "governance_notes": "Metadata only; not a stretch prescription.",
  "allowed_when": [
    "future_governed_assessment_rule_context_only",
    "not_runtime_selectable",
    "requires_clinical_rule_governance_before_use"
  ],
  "blocked_when": [
    "runtime_selection",
    "diagnosis_decision",
    "autonomous_triage",
    "prescription",
    "dosage_decision",
    "progression_decision",
    "readiness_decision",
    "rtt_rts_decision",
    "clearance_decision",
    "pass_fail_return_decision"
  ],
  "notes": "RF assessment metadata, Batch 1. This object is metadata only: it gathers qualitative evidence and creates no diagnosis, autonomous triage, prescription, dosage, progression, readiness, RTT/RTS, or clearance authority. Diagnosis/safety authority remains in RF-DX-*/RF-SAF-* clinical rules."
}
