{
  "assessment_id": "RF-ASSESS-018",
  "name": "movement_confidence_check",
  "module": "rectus_femoris",
  "assessment_status": "draft",
  "approval_status": "pending",
  "clinical_approval_status": "not_approved",
  "executable": false,
  "runtime_integration": "none",
  "permitted_use": "assessment_metadata_only",
  "assessment_purpose_category": "pain_response",
  "what_it_observes": "self-reported confidence to load/run/kick the injured area",
  "capacities_measured_or_informed": [
    "CAP-015"
  ],
  "rf_relevance": "confidence affects RF reintroduction tolerance",
  "user_facing_question_or_prompt": "How confident do you feel loading/running/kicking right now?",
  "clinician_facing_note": "Qualitative confidence evidence; never a readiness score.",
  "evidence_contribution": "Can raise CAP-015 evidence qualitatively.",
  "limitations": "Subjective.",
  "high_caution_flag": true,
  "governance_notes": "metadata only; not a readiness test; not sprint clearance; not kicking clearance; not RTS clearance; not competition clearance; not a progression gate; requires future clinical review before runtime use.",
  "allowed_when": [
    "future_governed_assessment_rule_context_only",
    "not_runtime_selectable",
    "requires_clinical_rule_governance_before_use"
  ],
  "blocked_when": [
    "runtime_selection",
    "diagnosis_decision",
    "autonomous_triage",
    "prescription",
    "dosage_decision",
    "progression_decision",
    "readiness_decision",
    "rtt_rts_decision",
    "clearance_decision",
    "pass_fail_return_decision"
  ],
  "notes": "RF assessment metadata, Batch 1. This object is metadata only: it gathers qualitative evidence and creates no diagnosis, autonomous triage, prescription, dosage, progression, readiness, RTT/RTS, or clearance authority. Diagnosis/safety authority remains in RF-DX-*/RF-SAF-* clinical rules."
}
