{
  "assessment_id": "RF-ASSESS-001",
  "name": "pain_location_and_mechanism_screen",
  "module": "rectus_femoris",
  "assessment_status": "draft",
  "approval_status": "pending",
  "clinical_approval_status": "not_approved",
  "executable": false,
  "runtime_integration": "none",
  "permitted_use": "assessment_metadata_only",
  "assessment_purpose_category": "diagnosis_support",
  "what_it_observes": "reported pain location, behaviour, and injury mechanism",
  "capacities_measured_or_informed": [],
  "rf_relevance": "anterior-thigh/RF mechanism context for downstream rule reasoning",
  "user_facing_question_or_prompt": "Where is your pain, and how did it start?",
  "clinician_facing_note": "Records location/mechanism as evidence for RF-DX-*; not a diagnosis.",
  "evidence_contribution": "Provides qualitative diagnosis_support context; no score.",
  "limitations": "Self-report; no imaging; not diagnostic on its own.",
  "high_caution_flag": false,
  "governance_notes": "Metadata only; diagnosis deferred to RF-DX-*/RF-SAF-*.",
  "allowed_when": [
    "future_governed_assessment_rule_context_only",
    "not_runtime_selectable",
    "requires_clinical_rule_governance_before_use"
  ],
  "blocked_when": [
    "runtime_selection",
    "diagnosis_decision",
    "autonomous_triage",
    "prescription",
    "dosage_decision",
    "progression_decision",
    "readiness_decision",
    "rtt_rts_decision",
    "clearance_decision",
    "pass_fail_return_decision"
  ],
  "notes": "RF assessment metadata, Batch 1. This object is metadata only: it gathers qualitative evidence and creates no diagnosis, autonomous triage, prescription, dosage, progression, readiness, RTT/RTS, or clearance authority. Diagnosis/safety authority remains in RF-DX-*/RF-SAF-* clinical rules."
}
