{
  "assessment_id": "RF-ASSESS-006",
  "name": "knee_flexion_tolerance_screen",
  "module": "rectus_femoris",
  "assessment_status": "draft",
  "approval_status": "pending",
  "clinical_approval_status": "not_approved",
  "executable": false,
  "runtime_integration": "none",
  "permitted_use": "assessment_metadata_only",
  "assessment_purpose_category": "range_of_motion",
  "what_it_observes": "tolerance of loaded/lengthened knee flexion and symptom response",
  "capacities_measured_or_informed": [
    "CAP-009"
  ],
  "rf_relevance": "lengthened anterior-thigh (RF) loading tolerance",
  "user_facing_question_or_prompt": "Can you bend your knee fully / kneel comfortably?",
  "clinician_facing_note": "Qualitative lengthened-load tolerance; no degrees.",
  "evidence_contribution": "Can raise CAP-009 evidence qualitatively.",
  "limitations": "Self-report/observation.",
  "high_caution_flag": false,
  "governance_notes": "Metadata only; no ROM/dose values.",
  "allowed_when": [
    "future_governed_assessment_rule_context_only",
    "not_runtime_selectable",
    "requires_clinical_rule_governance_before_use"
  ],
  "blocked_when": [
    "runtime_selection",
    "diagnosis_decision",
    "autonomous_triage",
    "prescription",
    "dosage_decision",
    "progression_decision",
    "readiness_decision",
    "rtt_rts_decision",
    "clearance_decision",
    "pass_fail_return_decision"
  ],
  "notes": "RF assessment metadata, Batch 1. This object is metadata only: it gathers qualitative evidence and creates no diagnosis, autonomous triage, prescription, dosage, progression, readiness, RTT/RTS, or clearance authority. Diagnosis/safety authority remains in RF-DX-*/RF-SAF-* clinical rules."
}
