{
  "assessment_id": "RF-ASSESS-017",
  "name": "next_day_response_check",
  "module": "rectus_femoris",
  "assessment_status": "draft",
  "approval_status": "pending",
  "clinical_approval_status": "not_approved",
  "executable": false,
  "runtime_integration": "none",
  "permitted_use": "assessment_metadata_only",
  "assessment_purpose_category": "next_day_response",
  "what_it_observes": "symptom/function response in the 24h after activity or loading",
  "capacities_measured_or_informed": [
    "CAP-001",
    "CAP-002",
    "CAP-003",
    "CAP-004",
    "CAP-005",
    "CAP-006",
    "CAP-007",
    "CAP-010"
  ],
  "rf_relevance": "core monitoring signal for RF load tolerance over time",
  "user_facing_question_or_prompt": "How did you feel the day after?",
  "clinician_facing_note": "Recurring monitoring evidence; no automatic progression/regression.",
  "evidence_contribution": "Can adjust capacity evidence/confidence qualitatively over time.",
  "limitations": "Self-report; recall-dependent.",
  "high_caution_flag": false,
  "governance_notes": "Metadata only; encodes no progression/readiness/clearance — adaptation belongs to future governed rules.",
  "allowed_when": [
    "future_governed_assessment_rule_context_only",
    "not_runtime_selectable",
    "requires_clinical_rule_governance_before_use"
  ],
  "blocked_when": [
    "runtime_selection",
    "diagnosis_decision",
    "autonomous_triage",
    "prescription",
    "dosage_decision",
    "progression_decision",
    "readiness_decision",
    "rtt_rts_decision",
    "clearance_decision",
    "pass_fail_return_decision"
  ],
  "notes": "RF assessment metadata, Batch 1. This object is metadata only: it gathers qualitative evidence and creates no diagnosis, autonomous triage, prescription, dosage, progression, readiness, RTT/RTS, or clearance authority. Diagnosis/safety authority remains in RF-DX-*/RF-SAF-* clinical rules."
}
