{
  "assessment_id": "RF-ASSESS-009",
  "name": "anterior_thigh_palpation_response",
  "module": "rectus_femoris",
  "assessment_status": "draft",
  "approval_status": "pending",
  "clinical_approval_status": "not_approved",
  "executable": false,
  "runtime_integration": "none",
  "permitted_use": "assessment_metadata_only",
  "assessment_purpose_category": "pain_response",
  "what_it_observes": "tenderness/response to anterior-thigh palpation",
  "capacities_measured_or_informed": [
    "CAP-010"
  ],
  "rf_relevance": "localizes anterior-thigh/RF symptom context",
  "user_facing_question_or_prompt": "Is there a tender spot when you press the front of your thigh?",
  "clinician_facing_note": "Localization evidence; not diagnosis.",
  "evidence_contribution": "Qualitative context; no score.",
  "limitations": "Self-palpation unreliable; supportive only.",
  "high_caution_flag": false,
  "governance_notes": "Metadata only; diagnosis stays in RF-DX-*/RF-SAF-*.",
  "allowed_when": [
    "future_governed_assessment_rule_context_only",
    "not_runtime_selectable",
    "requires_clinical_rule_governance_before_use"
  ],
  "blocked_when": [
    "runtime_selection",
    "diagnosis_decision",
    "autonomous_triage",
    "prescription",
    "dosage_decision",
    "progression_decision",
    "readiness_decision",
    "rtt_rts_decision",
    "clearance_decision",
    "pass_fail_return_decision"
  ],
  "notes": "RF assessment metadata, Batch 1. This object is metadata only: it gathers qualitative evidence and creates no diagnosis, autonomous triage, prescription, dosage, progression, readiness, RTT/RTS, or clearance authority. Diagnosis/safety authority remains in RF-DX-*/RF-SAF-* clinical rules."
}
