{
  "assessment_id": "RF-ASSESS-012",
  "name": "single_leg_control_observation",
  "module": "rectus_femoris",
  "assessment_status": "draft",
  "approval_status": "pending",
  "clinical_approval_status": "not_approved",
  "executable": false,
  "runtime_integration": "none",
  "permitted_use": "assessment_metadata_only",
  "assessment_purpose_category": "neuromuscular_control",
  "what_it_observes": "single-leg control quality and lumbopelvic control context",
  "capacities_measured_or_informed": [
    "CAP-013",
    "CAP-014"
  ],
  "rf_relevance": "control underpinning running/landing reintroduction",
  "user_facing_question_or_prompt": "Can you balance and control a single-leg movement?",
  "clinician_facing_note": "Qualitative control observation; no pass/fail.",
  "evidence_contribution": "Can raise CAP-013/CAP-014 evidence qualitatively.",
  "limitations": "Observational; not a validated test here.",
  "high_caution_flag": false,
  "governance_notes": "Metadata only; no pass/fail decision.",
  "allowed_when": [
    "future_governed_assessment_rule_context_only",
    "not_runtime_selectable",
    "requires_clinical_rule_governance_before_use"
  ],
  "blocked_when": [
    "runtime_selection",
    "diagnosis_decision",
    "autonomous_triage",
    "prescription",
    "dosage_decision",
    "progression_decision",
    "readiness_decision",
    "rtt_rts_decision",
    "clearance_decision",
    "pass_fail_return_decision"
  ],
  "notes": "RF assessment metadata, Batch 1. This object is metadata only: it gathers qualitative evidence and creates no diagnosis, autonomous triage, prescription, dosage, progression, readiness, RTT/RTS, or clearance authority. Diagnosis/safety authority remains in RF-DX-*/RF-SAF-* clinical rules."
}
