{
  "assessment_id": "RF-ASSESS-010",
  "name": "isometric_strength_capacity_check",
  "module": "rectus_femoris",
  "assessment_status": "draft",
  "approval_status": "pending",
  "clinical_approval_status": "not_approved",
  "executable": false,
  "runtime_integration": "none",
  "permitted_use": "assessment_metadata_only",
  "assessment_purpose_category": "strength_capacity",
  "what_it_observes": "ability to hold an isometric anterior-thigh contraction and response",
  "capacities_measured_or_informed": [
    "CAP-011"
  ],
  "rf_relevance": "early RF loading capacity",
  "user_facing_question_or_prompt": "Can you hold a steady push without symptoms increasing?",
  "clinician_facing_note": "Qualitative capacity evidence; no kg/%.",
  "evidence_contribution": "Can raise CAP-011 evidence qualitatively.",
  "limitations": "Not dynamometry unless added later.",
  "high_caution_flag": false,
  "governance_notes": "Metadata only; no load prescription.",
  "allowed_when": [
    "future_governed_assessment_rule_context_only",
    "not_runtime_selectable",
    "requires_clinical_rule_governance_before_use"
  ],
  "blocked_when": [
    "runtime_selection",
    "diagnosis_decision",
    "autonomous_triage",
    "prescription",
    "dosage_decision",
    "progression_decision",
    "readiness_decision",
    "rtt_rts_decision",
    "clearance_decision",
    "pass_fail_return_decision"
  ],
  "notes": "RF assessment metadata, Batch 1. This object is metadata only: it gathers qualitative evidence and creates no diagnosis, autonomous triage, prescription, dosage, progression, readiness, RTT/RTS, or clearance authority. Diagnosis/safety authority remains in RF-DX-*/RF-SAF-* clinical rules."
}
